ESTRATO,ISSN,TITULO
A2,1477-8238,KNOWLEDGE MANAGEMENT RESEARCH AND PRACTICE (PRINT)
B1,1477-9056,INTERNATIONAL JOURNAL OF PRODUCT DEVELOPMENT (PRINT)
A1,1478-3363,TOTAL QUALITY MANAGEMENT & BUSINESS EXCELLENCE (PRINT)
A1,1478-3371,TOTAL QUALITY MANAGEMENT AND BUSINESS EXCELLENCE (ONLINE)
B4,1478-9647,INTERNATIONAL JOURNAL OF INTELLECTUAL PROPERTY MANAGEMENT (PRINT)
B2,1478-9868,INTERNATIONAL JOURNAL OF ENVIRONMENT AND WASTE MANAGEMENT (ONLINE)
A2,1479-2931,MARITIME ECONOMICS & LOGISTICS (PRINT)
A1,1479-8409,JOURNAL OF FINANCIAL ECONOMETRICS
B4,1510-0839,AGROCIENCIA (MONTEVIDEO)
B1,1511-6670,INTERNATIONAL JOURNAL OF BUSINESS AND SOCIETY
A2,1514-0326,JOURNAL OF APPLIED ECONOMICS
A2,1516-3717,CADERNOS DE PSICOLOGIA SOCIAL DO TRABALHO (USP)
B1,1516-7429,REVISTA BRASILEIRA DE ADMINISTRAÇÃO PÚBLICA E DE EMPRESAS
A3,1516-9103,GESTÃO & PLANEJAMENTO (SALVADOR)
B2,1516-9537,TRABALHO & EDUCAÇÃO (UFMG)
B1,1517-0128,CADERNOS DE ÉTICA E FILOSOFIA POLÍTICA (USP)
NP,1517-3860,INTELIGÊNCIA EMPRESARIAL (UFRJ)
B1,1517-3879,ORGANIZAÇÕES RURAIS E AGROINDUSTRIAIS (UFLA)
NP,1517-4786,COMUNICADO TÉCNICO (EMBRAPA INSTRUMENTAÇÃO AGROPECUÁRIA)
A4,1517-5901,REVISTA POLÍTICA E TRABALHO
B3,1517-6304,REVISTA DE CIÊNCIAS EMPRESARIAIS DA UNIPAR (IMPRESSO)
NP,1517-8498,DOCUMENTOS - EMBRAPA AGROBIOLOGIA
C,1517-8595,REVISTA BRASILEIRA DE PRODUTOS AGROINDUSTRIAIS
B3,1517-9354,ECONOMIA E DESENVOLVIMENTO (RECIFE)
B2,1517-9427,UNOPAR CIENTÍFICA. CIÊNCIAS JURÍDICAS E EMPRESARIAIS
B4,1518-2711,REVISTA TRIBUTÁRIA E DE FINANÇAS PÚBLICAS
B3,1518-4285,POLÍTICAS SOCIAIS (IPEA)
NP,1518-7446,POLÍTICA DEMOCRÁTICA
A2,1518-952X,DESENVOLVIMENTO E MEIO AMBIENTE (UFPR)
C,1519-0307,CADERNOS DE POS-GRADUACAO EM DISTURBIOS DO DESENVOLVIMENTO
A4,1519-3314,HISTÓRIA ECONÔMICA & HISTÓRIA DE EMPRESAS
B3,1519-4744,REVISTA TURISMO E DESENVOLVIMENTO
A4,1519-549X,REVISTA PSICOLOGIA POLÍTICA (IMPRESSO)
A2,1519-7077,REVISTA CONTABILIDADE & FINANÇAS (IMPRESSO)
A4,1519-9029,POLÍTICA E GESTÃO EDUCACIONAL (ONLINE)
A3,1520-541X,EVOLUTION & DEVELOPMENT
A3,1520-6483,ENVIRONMENTAL QUALITY MANAGEMENT
C,1522-4600,NEXUS NETWORK JOURNAL
A4,1522-7227,INFANT AND CHILD DEVELOPMENT (PRINT)
A1,1523-2409,THE JOURNAL OF SUPPLY CHAIN MANAGEMENT
A4,1524-1904,APPLIED STOCHASTIC MODELS IN BUSINESS AND INDUSTRY (PRINT)
A1,1524-9042,PAIN MANAGEMENT NURSING (PRINT)
A4,1526-4025,APPLIED STOCHASTIC MODELS IN BUSINESS AND INDUSTRY (ONLINE)
A1,1526-498X,PEST MANAGEMENT SCIENCE (PRINT)
A4,1527-0025,JOURNAL OF SPORTS ECONOMICS
A1,1530-9142,REVIEW OF ECONOMICS AND STATISTICS (ONLINE: CATCHWORD LTD.)
A4,1532-4109,"JOURNAL OF ENVIRONMENTAL SCIENCE AND HEALTH. PART B: PESTICIDES, FOOD CONTAMINANTS, AND AGRICULTURAL WASTES"
A1,1534-5807,DEVELOPMENTAL CELL
B1,1534-973X,MARKETING MANAGEMENT JOURNAL
A1,1535-3958,CORPORATE SOCIAL-RESPONSIBILITY AND ENVIRONMENTAL MANAGEMENT
A3,1536-5433,"MANAGEMENT RESEARCH (ARMONK, N.Y.)"
B2,1537-1506,CHINESE BUSINESS REVIEW
B4,1537-1514,USA-CHINA BUSINESS REVIEW. (CHINESE)
A2,1537-2693,"JOURNAL OF AGRICULTURAL, BIOLOGICAL, AND ENVIRONMENTAL STATISTICS (ONLINE)"
B4,1539-3399,ONLINE JOURNAL OF RURAL NURSING AND HEALTH CARE
A2,1540-1405,JOURNAL OF THE NATIONAL COMPREHENSIVE CANCER NETWORK (PRINT)
A2,1540-496X,EMERGING MARKETS FINANCE & TRADE
B1,1540-658X,ASSAY AND DRUG DEVELOPMENT TECHNOLOGIES
C,1541-115X,ACCOUNTING DEPARTMENT MANAGEMENT REPORT
A4,1542-0485,JOURNAL OF AGRICULTURAL & FOOD INDUSTRIAL ORGANIZATION
A2,1542-0973,INTERNATIONAL JOURNAL OF SATELLITE COMMUNICATIONS AND NETWORKING (PRINT)
B1,1542-3166,JOURNAL OF PEACEBUILDING & DEVELOPMENT
B4,1542-8710,JOURNAL OF ACADEMY OF BUSINESS AND ECONOMICS
A4,1543-5075,INTERNATIONAL JOURNAL OF GREEN ENERGY
B1,1543-706X,IN VITRO CELLULAR & DEVELOPMENTAL BIOLOGY. ANIMAL (ONLINE)
NP,1543-8643,ACADEMY OF MANAGEMENT PROCEEDINGS
A3,1544-6123,FINANCE RESEARCH LETTERS (PRINT)
B1,1544-8037,JOURNAL OF INTERNATIONAL BUSINESS AND ECONOMICS
A4,1545-2921,ECONOMICS BULLETIN
A3,1547-3287,STEM CELLS AND DEVELOPMENT
A1,1547-3341,LANGUAGE LEARNING AND DEVELOPMENT
A4,1547-7355,JOURNAL OF HOMELAND SECURITY AND EMERGENCY MANAGEMENT (ONLINE)
A4,1548-0003,INTERNATIONAL JOURNAL OF APPLIED ECONOMICS
B1,1548-0666,INTERNATIONAL JOURNAL OF KNOWLEDGE MANAGEMENT
A2,1550-1329,INTERNATIONAL JOURNAL OF DISTRIBUTED SENSOR NETWORKS
A2,1551-3777,INTEGRATED ENVIRONMENTAL ASSESSMENT AND MANAGEMENT
B1,1551-9899,ADHOC & SENSOR WIRELESS NETWORKS
A3,1552-5007,"JOURNAL OF EXPERIMENTAL ZOOLOGY. PART B, MOLECULAR AND DEVELOPMENTAL EVOLUTION"
NP,1553-5495,JOURNAL OF GLOBAL BUSINESS AND TECHNOLOGY
B4,1553-5827,"THE BUSINESS REVIEW, CAMBRIDGE"
A1,1554-7191,INTERNATIONAL ENTREPRENEURSHIP AND MANAGEMENT JOURNAL
B1,1555-4015,EUROPEAN JOURNAL OF MANAGEMENT
C,1555-5542,"BIOLOGICAL THEORY: INTEGRATING DEVELOPMENT, EVOLUTION & COGNITION"
A2,1555-5879,REVIEW OF LAW & ECONOMICS
A3,1556-1801,NETWORKS AND HETEROGENEOUS MEDIA
B2,1556-7036,"ENERGY SOURCES. PART A, RECOVERY, UTILIZATION, AND ENVIRONMENTAL EFFECTS"
B2,1556-7230,"ENERGY SOURCES, PART A: RECOVERY, UTILIZATION, AND ENVIRONMENTAL EFFECTS"
A4,1556-7249,"ENERGY SOURCES. PART B, ECONOMICS, PLANNING, AND POLICY"
C,1557-4989,AMERICAN JOURNAL OF AGRICULTURAL AND BIOLOGICAL SCIENCES
A3,1557-5330,"COMMUNITY DEVELOPMENT (COLUMBUS, OHIO)"
A1,1557-7821,JOURNAL OF POST KEYNESIAN ECONOMICS (ONLINE)
A2,1559-2448,THE INTERNATIONAL FOOD AND AGRIBUSINESS MANAGEMENT REVIEW (ONLINE)
A4,1560-8530,INTERNATIONAL JOURNAL OF AGRICULTURE AND BIOLOGY
C,1561-0713,THE JOURNAL OF CETACEAN RESEARCH AND MANAGEMENT
A1,1566-113X,NETWORKS AND SPATIAL ECONOMICS
B3,1569-1500,PERSPECTIVES ON GLOBAL DEVELOPMENT AND TECHNOLOGY (PRINT)
A2,1570-646X,ENERGY EFFICIENCY (PRINT)
A2,1570-6478,ENERGY EFFICIENCY (ONLINE)
A1,1570-677X,ECONOMICS AND HUMAN BIOLOGY
A2,1570-8705,AD HOC NETWORKS
B1,1571-5124,INTERNATIONAL JOURNAL OF RIVER BASIN MANAGEMENT
C,1571-6244,URBAN AGRICULTURE MAGAZINE
A2,1572-963X,JOURNAL OF MANAGEMENT AND GOVERNANCE (ONLINE)
A3,1572-9680,AGROFORESTRY SYSTEMS
B1,1572-9974,COMPUTATIONAL ECONOMICS (ONLINE)
A2,1573-0468,JOURNAL OF REGULATORY ECONOMICS (DORDRECHT. ONLINE)
A2,1573-2479,"STRUCTURE & INFRASTRUCTURE ENGINEERING: MAINTENANCE, MANAGEMENT, LIFE-CYCLE DESIGN & PERFORMANCE"
A3,1573-4277,OPTICAL SWITCHING AND NETWORKING (PRINT)
B3,1575-1198,REVISTA ESPANOLA DE ESTUDIOS AGROSOCIALES Y PESQUEROS
A4,1577-239X,RIPS. REVISTA DE INVESTIGACINES POLÍTICAS Y SOCIOLÓGICAS
A3,1582-5949,"ANNALS OF THE UNIVERSITY OF PETROSANI, ECONOMICS"
A4,1582-9596,ENVIRONMENTAL ENGINEERING AND MANAGEMENT JOURNAL (PRINT)
A3,1612-4812,INTERNATIONAL ECONOMICS AND ECONOMIC POLICY
B1,1612-9830,JOURNAL OF AGRICULTURE AND RURAL DEVELOPMENT IN THE TROPICS AND SUBTROPICS (PRINT)
A3,1613-0960,INTERVENTION: EUROPEAN JOURNAL OF ECONOMICS AND ECONOMIC POLICIES
A3,1614-2446,ANNALS OF FINANCE (PRINT)
A2,1618-4742,EUROPEAN SPORT MANAGEMENT QUARTERLY
A1,1618-7598,THE EUROPEAN JOURNAL OF HEALTH ECONOMICS (PRINT)
B1,1645-4464,REVISTA PORTUGUESA E BRASILEIRA DE GESTÃO (LISBOA)
B3,1645-9261,REVISTA TURISMO & DESENVOLVIMENTO (ONLINE)
B1,1646-2408,TOURISM & MANAGEMENT STUDIES
B2,1646-8872,JOURNAL OF INTEGRATED COASTAL ZONE MANAGEMENT
C,1646-9127,REVISTA DE FINANÇAS PÚBLICAS E DIREITO FISCAL
B2,1648-6897,JOURNAL OF ENVIRONMENTAL ENGINEERING AND LANDSCAPE MANAGEMENT (PRINT)
B1,1661-5425,SEXUAL DEVELOPMENT
B4,1662-1387,INTERNATIONAL PUBLIC MANAGEMENT REVIEW
C,1668-4885,POLÍTICAS DE LA MEMORIA
B3,1669-3582,REVISTA ELECTRÓNICA DE PSICOLOGÍA POLÍTICA (EN LÍNEA)
A3,1674-1137,"CHINESE PHYSICS C, HIGH ENERGY PHYSICS AND NUCLEAR PHYSICS"
C,1676-6709,BOLETIM DE PESQUISA E DESENVOLVIMENTO - EMBRAPA AGROBIOLOGIA
B2,1676-8000,RBEE. REVISTA BRASILEIRA DE ECONOMIA DE EMPRESAS
NP,1676-918X,BOLETIM DE PESQUISA E DESENVOLVIMENTO (EMBRAPA CERRADOS)
C,1676-9732,REVISTA DE CIÊNCIAS AGROVETERINÁRIAS (UDESC)
B4,1677-0293,REVISTA CIENTÍFICA ELETRÔNICA DE AGRONOMIA
C,1677-1915,DOCUMENTOS - EMBRAPA AGROINDÚSTRIA TROPICAL
A4,1677-2504,REVISTA BRASILEIRA DE INOVAÇÃO
B1,1677-4140,POLÍTICA & SOCIEDADE (IMPRESSO)
C,1677-6062,REVISTA DE CIÊNCIAS AGRO-AMBIENTAIS (ONLINE)
NP,1677-891X,BOLETIM DE PESQUISA E DESENVOLVIMENTO (EMBRAPA PECUÁRIA SUDESTE. IMPRESSO)
A3,1677-9479,REVISTA GESTÃO & TECNOLOGIA
B4,1677-9762,REVISTA GESTÃO E CONHECIMENTO
C,1678-0892,BOLETIM DE PESQUISA E DESENVOLVIMENTO (EMBRAPA SOLOS. ONLINE)
A2,1678-166X,REVISTA BRASILEIRA DE POLÍTICA E ADMINISTRAÇÃO DA EDUCAÇÃO
C,1678-2518,BOLETIM DE PESQUISA E DESENVOLVIMENTO (EMBRAPA CLIMA TEMPERADO. IMPRESSO)
A4,1678-3921,PESQUISA AGROPECUÁRIA BRASILEIRA (ONLINE)
B4,1678-4057,REVISTA DE POLÍTICAS PÚBLICAS E GESTÃO GOVERNAMENTAL
A4,1678-4855,REVISTA DESENVOLVIMENTO EM QUESTÃO
C,1678-9601,BOLETIM DE PESQUISA E DESENVOLVIMENTO (CENTRO NACIONAL DE PESQUISA DE ARROZ E FEIJÃO. ONLINE)
A2,1678-992X,SCIENTIA AGRICOLA
B4,1679-043X,DOCUMENTOS. EMBRAPA AGROPECUÁRIA OESTE
A3,1679-0731,REVISTA BRASILEIRA DE FINANÇAS (IMPRESSO)
B2,1679-1614,REVISTA DE ECONOMIA E AGRONEGÓCIO
B1,1679-1827,GESTÃO.ORG
B4,1679-4435,REVISTA BRASILEIRA DE MEDICINA DO TRABALHO
C,1679-5938,POLÍTICA ECONÔMICA EM FOCO
C,1679-6535,COMUNICADO TÉCNICO (EMBRAPA AGROINDÚSTRIA TROPICAL. ONLINE)
C,1679-6543,BOLETIM DE PESQUISA E DESENVOLVIMENTO (EMBRAPA AGROINDÚSTRIA TROPICAL. ONLINE)
B4,1679-723X,FFBUSINESS
C,1679-8171,BRAZILIAN JOURNAL OF OPERATIONS AND PRODUCTION MANAGEMENT
A4,1679-9275,ACTA SCIENTIARUM. AGRONOMY (IMPRESSO)
A3,1680-7073,JOURNAL OF AGRICULTURAL SCIENCE AND TECHNOLOGY
B4,1681-8997,THE EMPIRICAL ECONOMICS LETTERS
A3,1687-1499,EURASIP JOURNAL ON WIRELESS COMMUNICATIONS AND NETWORKING
B1,1687-7357,ADVANCES IN HIGH ENERGY PHYSICS
B1,1687-8159,INTERNATIONAL JOURNAL OF AGRONOMY
C,1688-7840,CRÍTICA CONTEMPORÁNEA. REVISTA DE TEORÍA POLÍTICA
A4,1695-971X,SPANISH JOURNAL OF AGRICULTURAL RESEARCH
B3,1698-7950,"UNIVERSITAS. REVISTA DE FILOSOFÍA, DERECHO Y POLÍTICA"
B2,1699-9495,PECUNIA. REVISTA DE LA FACULTAD DE CIENCIAS ECONÓMICAS Y EMPRESARIALES
C,1729-7427,RUSSIAN MANAGEMENT JOURNAL
B1,1740-0562,INTERNATIONAL JOURNAL OF HIGH PERFORMANCE COMPUTING AND NETWORKING (PRINT)
A4,1740-0597,INTERNATIONAL JOURNAL OF BUSINESS ENVIRONMENT (ONLINE)
A2,1740-4754,EUROPEAN MANAGEMENT REVIEW
A3,1740-8830,INTERNATIONAL JOURNAL OF INNOVATION AND SUSTAINABLE DEVELOPMENT
A2,1741-038X,JOURNAL OF MANUFACTURING TECHNOLOGY MANAGEMENT
A1,1741-0398,JOURNAL OF ENTERPRISE INFORMATION MANAGEMENT
A2,1741-0401,THE INTERNATIONAL JOURNAL OF PRODUCTIVITY AND PERFORMANCE MANAGEMENT
A4,1741-2234,"WORLD REVIEW OF SCIENCE, TECHNOLOGY AND SUSTAINABLE DEVELOPMENT"
A3,1741-5098,INTERNATIONAL JOURNAL OF ENTREPRENEURSHIP AND INNOVATION MANAGEMENT (ONLINE)
A4,1741-5179,INTERNATIONAL JOURNAL OF INFORMATION TECHNOLOGY AND MANAGEMENT (ONLINE)
A3,1741-5292,"INTERNATIONAL JOURNAL OF TECHNOLOGY, POLICY AND MANAGEMENT"
B4,1741-5381,INTERNATIONAL JOURNAL OF LOGISTICS ECONOMICS AND GLOBALISATION
B3,1741-6361,"INTERNATIONAL JOURNAL OF NUCLEAR ENERGY, SCIENCE AND TECHNOLOGY (PRINT)"
B3,1741-637X,"INTERNATIONAL JOURNAL OF NUCLEAR ENERGY, SCIENCE AND TECHNOLOGY (ONLINE)"
B2,1741-7589,WATER MANAGEMENT
A3,1741-8127,INTERNATIONAL JOURNAL OF MANAGEMENT AND ENTERPRISE DEVELOPMENT (ONLINE)
B1,1741-8763,INTERNATIONAL JOURNAL OF BUSINESS PROCESS INTEGRATION AND MANAGEMENT (PRINT)
B1,1741-8771,INTERNATIONAL JOURNAL OF BUSINESS PROCESS INTEGRATION AND MANAGEMENT (ONLINE)
A1,1741-9182,INTERNATIONAL JOURNAL OF AGILE SYSTEMS AND MANAGEMENT
A2,1742-1705,RENEWABLE AGRICULTURE AND FOOD SYSTEMS (PRINT)
A3,1742-2043,CRITICAL PERSPECTIVES ON INTERNATIONAL BUSINESS
A4,1742-7967,INTERNATIONAL JOURNAL OF LOGISTICS SYSTEMS AND MANAGEMENT (PRINT)
A4,1742-7975,INTERNATIONAL JOURNAL OF LOGISTICS SYSTEMS AND MANAGEMENT
B3,1743-1026,OUTLOOKS ON PEST MANAGEMENT (PRINT)
B3,1743-1034,OUTLOOKS ON PEST MANAGEMENT
A4,1743-5110,INTERNATIONAL JOURNAL OF PRODUCT LIFECYCLE MANAGEMENT (PRINT)
B2,1743-761X,INTERNATIONAL JOURNAL OF SUSTAINABLE DEVELOPMENT AND PLANNING (ONLINE)
A3,1743-8187,INTERNATIONAL JOURNAL OF BUSINESS INTELLIGENCE AND DATA MINING
A1,1743-8276,INTERNATIONAL JOURNAL OF KNOWLEDGE MANAGEMENT STUDIES (ONLINE)
A3,1743-9132,INTERNATIONAL JOURNAL OF MANAGERIAL FINANCE
A1,1743-9671,JOURNAL OF THE ENERGY INSTITUTE (PRINT)
A3,1744-2370,INTERNATIONAL JOURNAL OF SERVICES AND OPERATIONS MANAGEMENT (PRINT)
A3,1744-2389,INTERNATIONAL JOURNAL OF SERVICES AND OPERATIONS MANAGEMENT
B4,1744-6635,INTERNATIONAL JOURNAL OF BUSINESS FORECASTING AND MARKETING INTELLIGENCE
A3,1744-9359,MANAGEMENT & ORGANIZATIONAL HISTORY (PRINT)
A1,1745-2007,ARCHITECTURAL ENGINEERING AND DESIGN MANAGEMENT
A4,1746-0972,INTERNATIONAL JOURNAL OF BUSINESS INFORMATION SYSTEMS (PRINT)
A4,1746-5648,QUALITATIVE RESEARCH IN ORGANIZATIONS AND MANAGEMENT (PRINT)
A3,1746-5664,JOURNAL OF MODELLING IN MANAGEMENT (PRINT)
A3,1746-6474,INTERNATIONAL JOURNAL OF PRODUCTIVITY AND QUALITY MANAGEMENT
B3,1747-6526,PROCEEDINGS OF THE INSTITUTION OF CIVIL ENGINEERS. WASTE AND RESOURCE MANAGEMENT (PRINT)
B1,1748-1279,INTERNATIONAL JOURNAL OF SENSOR NETWORKS
B4,1748-8133,WORLD SUSTAINABLE DEVELOPMENT OUTLOOK SERIES
B1,1749-8848,"PERSPECTIVES IN AGRICULTURE, VETERINARY SCIENCE, NUTRITION AND NATURAL RESOURCES"
A3,1749-9518,GEORISK: ASSESSMENT AND MANAGEMENT OF RISK FOR ENGINEERED SYSTEMS AND GEOHAZARDS
A1,1750-0680,CARBON BALANCE AND MANAGEMENT
C,1750-1938,JOURNAL OF AIRPORT MANAGEMENT
A4,1750-3868,INTERNATIONAL JOURNAL OF MANAGEMENT IN EDUCATION
A3,1750-6220,INTERNATIONAL JOURNAL OF ENERGY SECTOR MANAGEMENT (PRINT)
A1,1750-8592,CHILD DEVELOPMENT PERSPECTIVES
A3,1751-0252,INTERNATIONAL JOURNAL OF BUSINESS INNOVATION AND RESEARCH (PRINT)
A3,1751-0260,INTERNATIONAL JOURNAL OF BUSINESS INNOVATION AND RESEARCH (ONLINE)
B1,1751-1062,INTERNATIONAL JOURNAL OF WINE BUSINESS RESEARCH (PRINT)
B3,1751-2018,INTERNATIONAL JOURNAL OF BUSINESS AND SYSTEMS RESEARCH (ONLINE)
A4,1751-4231,PROCEEDINGS OF THE INSTITUTION OF CIVIL ENGINEERS. ENERGY (ONLINE)
B2,1751-7729,PROCEEDINGS OF ICE. WATER MANAGEMENT (ONLINE)
A4,1751-8423,DEVELOPMENTAL NEUROREHABILITATION
A3,1752-0479,INTERNATIONAL JOURNAL OF MONETARY ECONOMICS AND FINANCE (PRINT)
B4,1752-8224,INTERNATIONAL JOURNAL OF ACCOUNTING AND FINANCE (PRINT)
A3,1753-0296,INTERNATIONAL JOURNAL OF BUSINESS SCIENCE AND APPLIED MANAGEMENT
B4,1753-0660,INTERNATIONAL JOURNAL OF INNOVATION AND REGIONAL DEVELOPMENT
A2,1753-318X,JOURNAL OF FLOOD RISK MANAGEMENT
A3,1753-3627,INTERNATIONAL JOURNAL OF BUSINESS AND GLOBALISATION
B2,1753-6227,INTERNATIONAL JOURNAL OF BUSINESS AND EMERGING MARKETS
B4,1753-7169,"INTERNATIONAL JOURNAL OF DECISION SCIENCES, RISK AND MANAGEMENT"
A2,1753-8378,INTERNATIONAL JOURNAL OF MANAGING PROJECTS IN BUSINESS (PRINT)
A3,1753-8432,INTERNATIONAL JOURNAL OF PROCUREMENT MANAGEMENT
B1,1754-9957,JOURNAL OF WORLD ENERGY LAW AND BUSINESS (PRINT)
B4,1755-0084,RENEWABLE ENERGY FOCUS
A3,1755-425X,JOURNAL OF STRATEGY AND MANAGEMENT
A3,1756-0047,INTERNATIONAL JOURNAL OF BUSINESS EXCELLENCE (PRINT)
A3,1756-0055,INTERNATIONAL JOURNAL OF BUSINESS EXCELLENCE (ONLINE)
B1,1756-5278,INTERNATIONAL JOURNAL OF DEVELOPMENT EDUCATION AND GLOBAL LEARNING (ONLINE)
A1,1756-5537,CLIMATE AND DEVELOPMENT
A3,1756-8692,INTERNATIONAL JOURNAL OF CLIMATE CHANGE STRATEGIES AND MANAGEMENT
B3,1756-9850,INTERNATIONAL JOURNAL OF ECONOMICS AND BUSINESS RESEARCH
A1,1757-1693,GLOBAL CHANGE BIOLOGY. BIOENERGY
A4,1757-4323,ASIA-PACIFIC JOURNAL OF BUSINESS ADMINISTRATION
A1,1757-5818,JOURNAL OF SERVICE MANAGEMENT (PRINT)
A1,1757-7780,WILEY INTERDISCIPLINARY REVIEWS - CLIMATE CHANGE
A3,1758-1869,PAIN MANAGEMENT
A2,1758-3004,CARBON MANAGEMENT
A1,1758-6798,NATURE CLIMATE CHANGE
B3,1759-1163,"INTERNATIONAL JOURNAL OF DATA MINING, MODELLING AND MANAGEMENT"
A4,1759-5673,INTERNATIONAL JOURNAL OF EDUCATION ECONOMICS AND DEVELOPMENT
A1,1759-7331,QUANTITATIVE ECONOMICS
A1,1774-0746,AGRONOMY FOR SUSTAINABLE DEVELOPMENT
B1,1777-5949,CAHIERS AGRICULTURES
B1,1780-4507,"BIOTECHNOLOGY, AGRONOMY AND SOCIETY AND ENVIRONMENT"
B1,1790-5079,WSEAS TRANSACTIONS ON ENVIRONMENT AND DEVELOPMENT
B4,1792-6599,JOURNAL OF APPLIED FINANCE & BANKING (ONLINE)
A4,1793-6322,INTERNATIONAL JOURNAL OF THEORETICAL AND APPLIED FINANCE (ONLINE)
A3,1793-6950,INTERNATIONAL JOURNAL OF INNOVATION AND TECHNOLOGY MANAGEMENT
A4,1793-8171,MIDDLE EAST DEVELOPMENT JOURNAL
A4,1793-821X,JOURNAL OF CLEAN ENERGY TECHNOLOGIES
A4,1796-2056,JOURNAL OF NETWORKS
A3,1804-1930,AGRIS ON-LINE PAPERS IN ECONOMICS AND INFORMATICS
A4,1806-2261,CADERNOS GESTÃO PÚBLICA E CIDADANIA
A3,1806-4892,REVISTA BRASILEIRA DE GESTÃO DE NEGÓCIOS (SÃO PAULO. IMPRESSO)
A4,1806-6690,REVISTA CIÊNCIA AGRONÔMICA (UFC. ONLINE)
A3,1806-6720,RGO. REVISTA DE GESTÃO ORGANIZACIONAL (UNOCHAPECÓ. IMPRESSO)
NP,1806-8944,CADERNOS DE FINANÇAS PÚBLICAS
B1,1806-910X,REVISTA DIREITO EMPRESARIAL (CURITIBA)
A3,1806-9479,REVISTA DE ECONOMIA E SOCIOLOGIA RURAL (ONLINE)
B2,1806-9649,GESTÃO & PRODUÇÃO
B4,1807-1570,AGRIANUAL (SÃO PAULO)
B1,1807-1775,REVISTA DE GESTÃO DA TECNOLOGIA E SISTEMAS DE INFORMAÇÃO (ONLINE)
B4,1807-2674,REVISTA DE ECONOMIA POLÍTICA E HISTÓRIA ECONÔMICA
C,1807-491X,REVISTA AGRICULTURAS (IMPRESSO)
B1,1807-5436,GESTÃO E DESENVOLVIMENTO (PRINT)
C,1807-5908,SUSTAINABLE BUSINESS INTERNATIONAL JOURNAL
A2,1807-734X,BBR. BRAZILIAN BUSINESS REVIEW (EDIÇÃO EM PORTUGUÊS. ONLINE)
C,1808-0448,REVISTA GESTÃO INDUSTRIAL (ONLINE)
A3,1808-5792,GESTÃO E REGIONALIDADE
C,1808-6845,AGROPECUÁRIA CIENTÍFICA NO SEMI-ÁRIDO
B2,1808-799X,TRABALHO NECESSÁRIO
B4,1808-8759,ENERGIA NA AGRICULTURA
NP,1808-9968,BOLETIM DE PESQUISA E DESENVOLVIMENTO (EMBRAPA SEMI-ÁRIDO)
B3,1809-0214,GESTÃO CONTEMPORÂNEA (FAPA)
A2,1809-2039,RAI : REVISTA DE ADMINISTRAÇÃO E INOVAÇÃO
A3,1809-2276,REGE. REVISTA DE GESTÃO USP
A1,1809-239X,REVISTA BRASILEIRA DE GESTÃO E DESENVOLVIMENTO REGIONAL
B3,1809-2489,CAP ACCOUNTING AND MANAGEMENT (UFSC)
A1,1809-4465,ENSAIO - AVALIAÇÃO E POLÍTICAS PÚBLICAS EM EDUCAÇÃO
A3,1809-4538,REVISTA DE ECONOMIA POLÍTICA (ONLINE)
NP,1809-5003,BOLETIM DE PESQUISA E DESENVOLVIMENTO (EMBRAPA MANDIOCA E FRUTICULTURA TROPICAL. ONLINE)
A4,1809-564X,COMUNICAÇÃO & INOVAÇÃO
B4,1809-6670,GOVERNET. BOLETIM DO ORÇAMENTO E FINANÇAS
A4,1810-4967,INVESTMENT MANAGEMENT & FINANCIAL INNOVATIONS (PRINT)
B2,1812-5379,JOURNAL OF AGRONOMY (PRINT)
A1,1814-9324,CLIMATE OF THE PAST (PRINT)
B3,1814-9340,CLIMATE OF THE PAST DISCUSSIONS (PRINT)
A4,1814-9596,INTERNATIONAL JOURNAL OF AGRICULTURE & BIOLOGY (ONLINE)
C,1815-7440,JOURNAL OF CONTEMPORARY MANAGEMENT
C,1818-6769,AMERICAN-EURASIAN JOURNAL OF AGRICULTURAL & ENVIRONMENTAL SCIENCES
B1,1822-4202,BUSINESS: THEORY AND PRACTICE (ONLINE)
B1,1833-3850,INTERNATIONAL JOURNAL OF BUSINESS AND MANAGEMENT
A3,1838-6318,HISTORY OF ECONOMICS REVIEW
A4,1842-4309,NOTULAE BOTANICAE HORTI AGROBOTANICI CLUJ-NAPOCA (ONLINE)
C,1847-5450,"ORGANIZATION, TECHNOLOGY & MANAGEMENT IN CONSTRUCTION"
A4,1847-9790,INTERNATIONAL JOURNAL OF ENGINEERING BUSINESS MANAGEMENT
C,1848-9257,"JOURNAL OF SUSTAINABLE DEVELOPMENT OF ENERGY, WATER AND ENVIRONMENT SYSTEMS"
B4,1849-5664,INTERNATIONAL JOURNAL OF MANAGEMENT SCIENCE AND BUSINESS ADMINISTRATION
B3,1852-5784,ANUARIO CEEED - CENTRO DE ESTUDIOS ECONÓMICOS DE LA EMPRESA Y EL DESARROLLO
B2,1853-7723,POLHIS. REVISTA BIBLIOGRÁFICA DEL PROGRAMA INTERUNIVERSITARIO DE HISTORIA POLÍTICA
B4,1857-8721,JOURNAL OF APPLIED ECONOMICS AND BUSINESS
B1,1862-9679,MATHEMATICS AND FINANCIAL ECONOMICS
A4,1864-6042,ECONOMICS. JOURNAL ARTICLES
B1,1865-1348,LECTURE NOTES IN BUSINESS INFORMATION PROCESSING
A3,1868-3975,ENERGY SYSTEMS
A2,1869-5469,SOCIAL NETWORK ANALYSIS AND MINING
B3,1870-0462,TROPICAL AND SUBTROPICAL AGROECOSYSTEMS
B4,1874-3315,THE OPEN AGRICULTURE JOURNAL
C,1876-1429,"RECENT PATENTS ON FOOD, NUTRITION & AGRICULTURE"
A3,1876-6102,ENERGY PROCEDIA
A2,1878-7789,NANO COMMUNICATION NETWORKS
A2,1878-8181,BIOCATALYSIS AND AGRICULTURAL BIOTECHNOLOGY
A4,1879-4238,ORGANIC AGRICULTURE
A2,1879-9337,REVIEW OF DEVELOPMENT FINANCE
A4,1881-8366,"ENGINEERING IN AGRICULTURE, ENVIRONMENT AND FOOD"
C,1887-9292,AGRICULTURA FAMILIAR EN ESPAÑA
B4,1889-0776,TIERRAS DE CASTILLA Y LEÓN - AGRICULTURA
B3,1898-2263,ANNALS OF AGRICULTURAL AND ENVIRONMENTAL MEDICINE
C,1909-9959,BIOTECNOLOGÍA EN EL SECTOR AGROPECUARIO Y AGROINDUSTRIAL
C,1911-8066,JOURNAL OF RISK AND FINANCIAL MANAGEMENT (VERSÃO IMPRESSA)
C,1911-8074,JOURNAL OF RISK AND FINANCIAL MANAGEMENT (VERSÃO DIGITAL)
A4,1913-3715,"INTERNATIONAL JOURNAL OF COMMUNICATIONS, NETWORK AND SYSTEM SCIENCES"
C,1913-9004,INTERNATIONAL BUSINESS RESEARCH
A2,1913-9063,JOURNAL OF SUSTAINABLE DEVELOPMENT (IMPRESSO)
A2,1913-9071,JOURNAL OF SUSTAINABLE DEVELOPMENT
B1,1916-971X,INTERNATIONAL JOURNAL OF ECONOMICS AND FINANCE
B4,1916-9760,JOURNAL OF AGRICULTURAL SCIENCE
A1,1923-4015,INTERNATIONAL JOURNAL OF BUSINESS ADMINISTRATION
C,1923-7324,JOURNAL OF UBIQUITOUS SYSTEMS AND PERVASIVE NETWORKS (PRINT)
C,1923-7332,NTERNATIONAL JOURNAL OF UBIQUITOUS SYSTEMS AND PERVASIVE NETWORKS
B1,1923-7529,REVIEW OF ECONOMICS AND FINANCE
B1,1923-8401,REVIEW OF ECONOMICS & FINANCE
A2,1925-4733,JOURNAL OF MANAGEMENT AND SUSTAINABILITY
B1,1927-0321,TECHNOLOGY INNOVATION MANAGEMENT REVIEW
B4,1927-050X,SUSTAINABLE AGRICULTURE RESEARCH
C,1927-7326,ENGINEERING MANAGEMENT RESEARCH (ONLINE)
C,1929-6002,JOURNAL OF TECHNOLOGY INNOVATIONS IN RENEWABLE ENERGY
A1,1932-4537,IEEE ETRANSACTIONS ON NETWORK AND SERVICE MANAGEMENT
A3,1932-846X,DEVELOPMENTAL NEUROBIOLOGY
B4,1934-8037,RUSSIAN AGRICULTURAL SCIENCES
C,1934-8975,JOURNAL OF ENERGY AND POWER ENGINEERING
A4,1936-6442,PEER-TO-PEER NETWORKING AND APPLICATIONS (PRINT)
A4,1939-0122,SECURITY AND COMMUNICATION NETWORKS
A1,1939-1234,BIOENERGY RESEARCH
C,1939-1250,JOURNAL OF AGRICULTURAL SCIENCE AND TECHNOLOGY B (USA. PRINT)
B1,1939-6104,ACADEMY OF STRATEGIC MANAGEMENT JOURNAL
A3,1940-5979,REVIEW OF BEHAVIORAL FINANCE
B1,1941-7012,JOURNAL OF RENEWABLE AND SUSTAINABLE ENERGY
B1,1941-899X,JOURNAL OF MANAGEMENT RESEARCH
C,1942-2644,THE INTERNATIONAL JOURNAL ON ADVANCES IN NETWORKS AND SERVICES
A4,1942-7905,POPULATION HEALTH MANAGEMENT
A1,1943-0620,JOURNAL OF OPTICAL COMMUNICATIONS AND NETWORKING (PRINT)
C,1943-3581,INTERNATIONAL JOURNAL NETWORK PROTOCOLS AND ALGORITHMS
A4,1943-3867,THE LAW AND DEVELOPMENT REVIEW
A2,1943-4308,EVENT MANAGEMENT (ONLINE)
A2,1944-7442,ENVIRONMENTAL PROGRESS & SUSTAINABLE ENERGY (PRINT)
A2,1944-7450,ENVIONMETAL PROGRESS & SUSTAINABLE ENERGY
A1,1945-7669,AMERICAN ECONOMIC JOURNAL: MICROECONOMICS
A1,1945-7782,AMERICAN ECONOMIC JOURNAL: APPLIED ECONOMICS
A2,1946-3138,INTERNATIONAL JOURNAL OF URBAN SUSTAINABLE DEVELOPMENT
B2,1947-3192,INTERNATIONAL JOURNAL OF AGRICULTURAL AND ENVIRONMENTAL INFORMATION SYSTEMS
C,1947-3818,ENERGY AND POWER ENGINEERING
B1,1947-5667,GLOBAL BUSINESS AND MANAGEMENT RESEARCH
A4,1947-7988,JOURNAL OF PHOTONICS FOR ENERGY
A1,1947-8402,INTERNATIONAL JOURNAL OF SOCIAL ECOLOGY AND SUSTAINABLE DEVELOPMENT
A1,1948-8327,"WEATHER, CLIMATE AND SOCIETY"
A1,1949-3029,IEEE TRANSACTIONS ON SUSTAINABLE ENERGY
C,1958-5853,INNOVATIONS AGRONOMIQUES
B4,1980-0258,ANAIS DA ACADEMIA PERNAMBUCANA DE CIÊNCIA AGRONÔMICA
C,1980-0711,ANÁLISES E INDICADORES DO AGRONEGÓCIO
B2,1980-1378,REVISTA INOVAÇÃO (FAPEMA)
A3,1980-2447,BRAZILIAN REVIEW OF ECONOMETRICS
B2,1980-5160,S & G. SISTEMAS & GESTÃO
B1,1980-5756,GESTÃO E SOCIEDADE
B1,1980-6965,REVISTA ACADÊMICA OBSERVATÓRIO DE INOVAÇÃO DO TURISMO
A4,1980-7791,REVISTA ELETRÔNICA DIREITO E POLÍTICA
A3,1981-1543,GESTÃO & TECNOLOGIA DE PROJETOS
C,1981-1551,SOCIEDADE E DESENVOLVIMENTO RURAL
A3,1981-1829,CIÊNCIA E AGROTECNOLOGIA (ONLINE)
A3,1981-1969,JORNAL DE POLÍTICAS EDUCACIONAIS
B4,1981-2221,REVISTA BRASILEIRA DE DIREITO TRIBUTÁRIO E FINANÇAS PÚBLICAS
B4,1981-3686,REVISTA BRASILEIRA DE TECNOLOGIA AGROINDUSTRIAL
B3,1981-4127,REVISTA ELETRÔNICA AMBIENTE: GESTÃO E DESENVOLVIMENTO
B3,1981-6278,RECIIS-REVISTA ELETRÔNICA DE COM. INFORMAÇÃO & INOVAÇÃO EM SAÚDE
B2,1981-7746,"TRABALHO, EDUCAÇÃO E SAÚDE (ONLINE)"
B4,1981-8203,REVISTA VERDE DE AGROECOLOGIA E DESENVOLVIMENTO SUSTENTÁVEL
NP,1981-9803,P&D: REVISTA PESQUISA E DESENVOLVIMENTO DA ANEEL
A3,1981-982X,REVISTA DE GESTÃO SOCIAL E AMBIENTAL (RGSA)
A4,1981-9951,RAMA : REVISTA EM AGRONEGÓCIO E MEIO AMBIENTE
B4,1981-996X,"SEMIOSES: INOVAÇÃO, DESENVOLVIMENTO E SUSTENTABILIDADE"
B3,1982-1115,REVISTA DE CIÊNCIAS EMPRESARIAIS DA UNIPAR
B2,1982-1785,RVISTA ELETRÔNICA GESTÃO& SAÚDE
A4,1982-2537,REVISTA DA MICRO E PEQUENA EMPRESA (FACCAMP)
C,1982-2871,TECNOLOGIA & CIÊNCIA AGROPECUÁRIA
B3,1982-3207,POLÍTICAS EDUCATIVAS
B4,1982-4092,REVISTA DE GESTÃO PÚBLICA/DF
B2,1982-4289,"PERSEU: HISTÓRIA, MEMÓRIA E POLÍTICA"
B3,1982-4785,REVISTA ELETRÔNICA GESTÃO & SAÚDE
A3,1982-6745,REDES REVISTA DO DESENVOLVIMENTO REGIONAL
A3,1982-7342,"SOCIEDADE, CONTABILIDADE E GESTÃO (UFRJ)"
B4,1982-7679,REVISTA BRASILEIRA DE AGRICULTURA IRRIGADA
B4,1982-8470,AGRO@MBIENTE ON-LINE
B4,1982-8608,REVISTA DESENVOLVIMENTO SOCIAL
B4,1982-9884,ESTUDOS DO TRABALHO
NP,1983-0483,BOLETIM DE PESQUISA E DESENVOLVIMENTO (EMBRAPA AMAZÔNIA ORIENTAL. ONLINE)
A1,1983-3121,REVISTA BRASILEIRA DE POLÍTICA INTERNACIONAL (ONLINE)
B3,1983-3717,POLÍTICAS CULTURAIS EM REVISTA
B3,1983-3733,PERSPECTIVAS EM POLÍTICAS PÚBLICAS
B2,1983-4063,PESQUISA AGROPECUÁRIA TROPICAL (ONLINE)
B1,1983-4535,REVISTA GESTÃO UNIVERSITÁRIA NA AMÉRICA LATINA - GUAL
B1,1983-5205,RAHIS. REVISTA DE ADMINISTRAÇÃO HOSPITALAR E INOVAÇÃO EM SAÚDE
B1,1983-5264,RSDE. REVISTA SEMESTRAL DE DIREITO EMPRESARIAL
C,1983-6325,PESQUISA APLICADA & AGROTECNOLOGIA (IMPRESSO)
B4,1983-8166,REBAP - REVISTA BRASILEIRA DE ADMINISTRAÇÃO POLÍTICA
C,1984-0756,ECONOMIA POLÍTICA DO DESENVOLVIMENTO
C,1984-2430,"GEPROS GESTÃO DA PRODUÇÃO, OPERAÇÕES E SISTEMAS"
A2,1984-2503,PASSAGENS: REVISTA INTERNACIONAL DE HISTÓRIA POLÍTICA E CULTURA JURÍDICA
B1,1984-3046,JOSCM. JOURNAL OF OPERATIONS AND SUPPLY CHAIN MANAGEMENT
C,1984-3097,GESTÃO UNIVERSITÁRIA
C,1984-3534,PESQUISA OPERACIONAL PARA O DESENVOLVIMENTO
A3,1984-3925,"CONTABILIDADE, GESTÃO E GOVERNANÇA"
C,1984-4123,BIBLIOTECA DIGITAL FÓRUM DE CONTRATAÇÃO E GESTÃO PÚBLICA (ONLINE)
B2,1984-4271,REVISTA CIÊNCIA & DESENVOLVIMENTO
